{
  "claim_id": "claim:m87:ring-image",
  "claim_text": "A ring-like image can be reconstructed from calibrated VLBI measurements under declared algorithms and parameters.",
  "claim_type": "REC",
  "status": "supported",
  "evidence_level": "S3",
  "created_at": "2026-07-25T00:00:00Z",
  "version": 4,
  "supersedes": null,
  "evidence_refs": [
    "evidence:m87:ehtim-bootstrap-reproduction",
    "evidence:m87:ehtim-podman-runtime-confirmation",
    "evidence:m87:paper-derived-morphology-stability"
  ],
  "assumption_refs": [
    "assumption:m87:gr-model"
  ],
  "alternative_claim_refs": [
    "claim:m87:calibration-artifact",
    "claim:m87:imaging-prior-artifact",
    "claim:m87:jet-only-morphology",
    "claim:m87:non-kerr-compact-object",
    "claim:m87:variability-bias"
  ]
}
