{
  "claim_id": "claim:m87:imaging-prior-artifact",
  "claim_text": "Sparse Fourier coverage and imaging priors force a ring-like reconstruction that is not required by the calibrated observables.",
  "claim_type": "SPEC",
  "status": "not_assessed",
  "evidence_level": "S0",
  "created_at": "2026-07-25T00:00:00Z",
  "version": 1,
  "supersedes": null,
  "evidence_refs": [],
  "assumption_refs": [],
  "alternative_claim_refs": [
    "claim:m87:ring-image"
  ]
}