{
  "claim_id": "claim:m87:calibration-artifact",
  "claim_text": "The ring-scale signature is primarily produced by shared calibration error rather than source structure.",
  "claim_type": "SPEC",
  "status": "not_assessed",
  "evidence_level": "S0",
  "created_at": "2026-07-25T00:00:00Z",
  "version": 1,
  "supersedes": null,
  "evidence_refs": [],
  "assumption_refs": [],
  "alternative_claim_refs": [
    "claim:m87:ring-image"
  ]
}